{
  "schemaVersion": 1,
  "from": "aaaaaaaaaaaaaaaaaaaaaaaaaaaaaaaaaaaaaaaa",
  "to": "bbbbbbbbbbbbbbbbbbbbbbbbbbbbbbbbbbbbbbbb",
  "files": [
    {
      "path": "a.py",
      "status": "modified",
      "fromBlob": "cccccccccccccccccccccccccccccccccccccccccccccccccccccccccccccccc",
      "toBlob": "dddddddddddddddddddddddddddddddddddddddddddddddddddddddddddddddd",
      "hunks": [
        {
          "fromRange": [
            1,
            3
          ],
          "toRange": [
            1,
            4
          ],
          "header": "@@ -1,3 +1,4 @@"
        }
      ]
    },
    {
      "path": "b.py",
      "status": "added",
      "toBlob": "cccccccccccccccccccccccccccccccccccccccccccccccccccccccccccccccc",
      "hunks": [
        {
          "fromRange": null,
          "toRange": [
            1,
            10
          ]
        }
      ]
    }
  ]
}
